{"$schema":"https://json-schema.org/draft/2020-12/schema","$id":"source-adapters-v1","type":"object","additionalProperties":false,"required":["schemaVersion","id","version","owner","adapters"],"properties":{"schemaVersion":{"const":"source-adapters-v1"},"id":{"type":"string"},"version":{"type":"string"},"owner":{"const":"source_adapter"},"adapters":{"type":"array"}}}
