{"adapters":[{"adapterId":"canonical-fixture-evidence","mediaType":"application/vnd.eqb.canonical-fixture+json","version":"1"},{"adapterId":"docx-source-envelope","mediaType":"application/vnd.eqb.docx-source-envelope+json","version":"2"},{"adapterId":"application-writing-source-capture","mediaType":"application/vnd.eqb.application-writing-source-capture+json","version":"2"},{"adapterId":"application-writing-source-transcription","mediaType":"application/vnd.eqb.application-writing-source-transcription+json","version":"1"},{"adapterId":"continuation-writing-source-capture","mediaType":"application/vnd.eqb.continuation-writing-source-capture+json","version":"2"},{"adapterId":"continuation-writing-source-transcription","mediaType":"application/vnd.eqb.continuation-writing-source-transcription+json","version":"2"},{"adapterId":"listening-questions-source","mediaType":"application/vnd.eqb.listening-questions+json","version":"1"},{"adapterId":"listening-answers-source","mediaType":"application/vnd.eqb.listening-answers+json","version":"1"},{"adapterId":"listening-transcript-source","mediaType":"application/vnd.eqb.listening-transcript+json","version":"1"},{"adapterId":"listening-source-inventory","mediaType":"application/vnd.eqb.listening-source-inventory+json","version":"1"},{"adapterId":"grammar-fill-prompt-evidence","mediaType":"application/vnd.eqb.grammar-fill-prompt-source-capture+json","version":"2"},{"adapterId":"nck1-source-materialization","mediaType":"application/vnd.eqb.nck1-source-materialization+json","version":"2"},{"adapterId":"nck1-source-materialization","mediaType":"application/vnd.eqb.nck1-source-materialization+json","version":"3"},{"adapterId":"nck1-source-materialization","mediaType":"application/vnd.eqb.nck1-source-materialization+json","version":"4"},{"adapterId":"nck1-source-materialization","mediaType":"application/vnd.eqb.nck1-source-materialization+json","version":"5"},{"adapterId":"nck1-source-materialization","mediaType":"application/vnd.eqb.nck1-source-materialization+json","version":"6"},{"adapterId":"nck1-source-materialization","mediaType":"application/vnd.eqb.nck1-source-materialization+json","version":"7"},{"adapterId":"nck1-source-materialization","mediaType":"application/vnd.eqb.nck1-source-materialization+json","version":"8"},{"adapterId":"nck1-source-materialization","mediaType":"application/vnd.eqb.nck1-source-materialization+json","version":"9"},{"adapterId":"nck1-source-materialization","mediaType":"application/vnd.eqb.nck1-source-materialization+json","version":"10"},{"adapterId":"nck1-source-materialization","mediaType":"application/vnd.eqb.nck1-source-materialization+json","version":"11"},{"adapterId":"nck1-source-materialization","mediaType":"application/vnd.eqb.nck1-source-materialization+json","version":"12"},{"adapterId":"nck1-source-materialization","mediaType":"application/vnd.eqb.nck1-source-materialization+json","version":"13"},{"adapterId":"nck1-source-materialization","mediaType":"application/vnd.eqb.nck1-source-materialization+json","version":"14"},{"adapterId":"nck1-source-materialization","mediaType":"application/vnd.eqb.nck1-source-materialization+json","version":"15"},{"adapterId":"nck1-source-materialization","mediaType":"application/vnd.eqb.nck1-source-materialization+json","version":"16"},{"adapterId":"nck1-source-materialization","mediaType":"application/vnd.eqb.nck1-source-materialization+json","version":"17"},{"adapterId":"nck1-source-materialization","mediaType":"application/vnd.eqb.nck1-source-materialization+json","version":"18"}],"id":"source-adapters","owner":"source_adapter","schemaVersion":"source-adapters-v1","version":"33"}
